<?xml version="1.0"?>

<!DOCTYPE dcs:gridpov-conf SYSTEM "gridpov-conf.dtd">

<dcs:gridpov-conf xmlns:dcs="http://dcs.di.unipmn.it" version="1.0">
	<!-- MyGrid section -->
	<dcs:mygrid>
		<dcs:mygrid-cmd>/usr/local/opt/OurGrid/mygrid/bin/mygrid</dcs:mygrid-cmd>

		<dcs:mygrid-jdf>
			<dcs:mygrid-jdf-store-path>$STORAGE</dcs:mygrid-jdf-store-path>
			<dcs:mygrid-jdf-store-method>store</dcs:mygrid-jdf-store-method>
			<dcs:mygrid-jdf-tmp-path>$PLAYPEN</dcs:mygrid-jdf-tmp-path>
		</dcs:mygrid-jdf>
	</dcs:mygrid>

	<!-- POV-Ray section -->
	<dcs:povray>
		<dcs:povray-cmd>/usr/local/bin/povray</dcs:povray-cmd>
		<dcs:povray-libs>/usr/local/share/povray/include</dcs:povray-libs>
		<dcs:povray-libs>/usr/local/share/povray/include/LightsysIV</dcs:povray-libs>
		<dcs:povray-exec-steps>
			<dcs:povray-exec-step>
				<dcs:povray-exec-step-infile>dissolution.pov</dcs:povray-exec-step-infile>
				<dcs:povray-exec-step-outfile>dissolution.png</dcs:povray-exec-step-outfile>
			</dcs:povray-exec-step>
		</dcs:povray-exec-steps>
	</dcs:povray>

	<!-- Scene configurazione -->
	<dcs:scene label="dissolution">
		<dcs:scene-files>
			<dcs:scene-file>test/scenes/dissolution/cell.inc</dcs:scene-file>
<!-- LightsysIV file (already available on grid machines)
			<dcs:scene-file>test/scenes/dissolution/CIE.inc</dcs:scene-file>
			<dcs:scene-file>test/scenes/dissolution/CIE_precalculation.pov</dcs:scene-file>
			<dcs:scene-file>test/scenes/dissolution/CIE_Skylight.inc</dcs:scene-file>
			<dcs:scene-file>test/scenes/dissolution/CIE_tools.inc</dcs:scene-file>
-->
			<dcs:scene-file>test/scenes/dissolution/dissolution.pov</dcs:scene-file>
			<dcs:scene-file>test/scenes/dissolution/espd_cie_standard.inc</dcs:scene-file>
			<dcs:scene-file>test/scenes/dissolution/espd_lightsys.inc</dcs:scene-file>
			<dcs:scene-file>test/scenes/dissolution/espd_sun.inc</dcs:scene-file>
			<dcs:scene-file>test/scenes/dissolution/fbodies.inc</dcs:scene-file>
			<dcs:scene-file>test/scenes/dissolution/lights.inc</dcs:scene-file>
			<dcs:scene-file>test/scenes/dissolution/lightsys_colors.inc</dcs:scene-file>
			<dcs:scene-file>test/scenes/dissolution/lightsys_constants.inc</dcs:scene-file>
			<dcs:scene-file>test/scenes/dissolution/lightsys.inc</dcs:scene-file>
			<dcs:scene-file>test/scenes/dissolution/linemapn.png</dcs:scene-file>
			<dcs:scene-file>test/scenes/dissolution/lspd_elements.inc</dcs:scene-file>
			<dcs:scene-file>test/scenes/dissolution/manipulator.inc</dcs:scene-file>
			<dcs:scene-file>test/scenes/dissolution/metal1.png</dcs:scene-file>
			<dcs:scene-file>test/scenes/dissolution/rspd_aster.inc</dcs:scene-file>
			<dcs:scene-file>test/scenes/dissolution/rspd_jvp.inc</dcs:scene-file>
			<dcs:scene-file>test/scenes/dissolution/rspd_lunar.inc</dcs:scene-file>
			<dcs:scene-file>test/scenes/dissolution/rspd_pantone_coated.inc</dcs:scene-file>
			<dcs:scene-file>test/scenes/dissolution/rspd_pantone_matte.inc</dcs:scene-file>
			<dcs:scene-file>test/scenes/dissolution/rspd_pantone_uncoated.inc</dcs:scene-file>
			<dcs:scene-file>test/scenes/dissolution/scratch.jpg</dcs:scene-file>
		</dcs:scene-files>
		<dcs:scene-width value="800"/>
		<dcs:scene-height value="600"/>
<!--
		<dcs:scene-bounding threshold="3"/>
		<dcs:scene-quality value="3"/>
		<dcs:scene-antialias threshold="3" method="1" jitter="0.0" depth="0"/>
		<dcs:scene-alpha/>
		<dcs:scene-lightbuf/>
		<dcs:scene-vistabuf/>
-->
		<dcs:scene-antialias threshold="3"/>
<!--
		<dcs:scene-blocksize value="64"/>
-->
		<dcs:scene-blocksize value="256"/>
		<dcs:scene-imagefmt type="N" bits="8"/>
	</dcs:scene>
</dcs:gridpov-conf>
