<?xml version="1.0"?>

<!DOCTYPE dcs:gridpov-conf SYSTEM "gridpov-conf.dtd">

<dcs:gridpov-conf xmlns:dcs="http://dcs.di.unipmn.it" version="1.0">
	<!-- MyGrid section -->
	<dcs:mygrid>
		<dcs:mygrid-cmd>/usr/local/opt/OurGrid/mygrid/bin/mygrid</dcs:mygrid-cmd>

		<dcs:mygrid-jdf>
			<dcs:mygrid-jdf-store-path>$STORAGE</dcs:mygrid-jdf-store-path>
			<dcs:mygrid-jdf-store-method>store</dcs:mygrid-jdf-store-method>
			<dcs:mygrid-jdf-tmp-path>$PLAYPEN</dcs:mygrid-jdf-tmp-path>
		</dcs:mygrid-jdf>
	</dcs:mygrid>

	<!-- POV-Ray section -->
	<dcs:povray>
		<dcs:povray-cmd>/usr/local/bin/povray</dcs:povray-cmd>
		<dcs:povray-libs>/usr/local/share/povray/include</dcs:povray-libs>
		<dcs:povray-libs>/usr/local/share/povray/include/LightsysIV</dcs:povray-libs>
		<dcs:povray-exec-steps>
			<dcs:povray-exec-step>
				<dcs:povray-exec-step-infile>minicooper.pov</dcs:povray-exec-step-infile>
				<dcs:povray-exec-step-outfile>minicooper.png</dcs:povray-exec-step-outfile>
			</dcs:povray-exec-step>
		</dcs:povray-exec-steps>
	</dcs:povray>

	<!-- Scene configurazione -->
	<dcs:scene label="minicooper">
		<dcs:scene-files>
			<dcs:scene-file>test/scenes/minicooper/minicooper.pov</dcs:scene-file>
			<dcs:scene-file>test/scenes/minicooper/bd_border_o.inc</dcs:scene-file>
			<dcs:scene-file>test/scenes/minicooper/bd_bricks1_bump.jpg</dcs:scene-file>
			<dcs:scene-file>test/scenes/minicooper/bd_bricks1.jpg</dcs:scene-file>
			<dcs:scene-file>test/scenes/minicooper/bd_bricks1_o.inc</dcs:scene-file>
			<dcs:scene-file>test/scenes/minicooper/bd_bricks2_bump.jpg</dcs:scene-file>
			<dcs:scene-file>test/scenes/minicooper/bd_bricks2.jpg</dcs:scene-file>
			<dcs:scene-file>test/scenes/minicooper/bd_colside1_bump.jpg</dcs:scene-file>
			<dcs:scene-file>test/scenes/minicooper/bd_colside1.jpg</dcs:scene-file>
			<dcs:scene-file>test/scenes/minicooper/bd_colside1_o.inc</dcs:scene-file>
			<dcs:scene-file>test/scenes/minicooper/bd_column1b_bump.jpg</dcs:scene-file>
			<dcs:scene-file>test/scenes/minicooper/bd_column1b.jpg</dcs:scene-file>
			<dcs:scene-file>test/scenes/minicooper/bd_column1_bump.jpg</dcs:scene-file>
			<dcs:scene-file>test/scenes/minicooper/bd_column1c_bump.jpg</dcs:scene-file>
			<dcs:scene-file>test/scenes/minicooper/bd_column1c.jpg</dcs:scene-file>
			<dcs:scene-file>test/scenes/minicooper/bd_column1d_bump.jpg</dcs:scene-file>
			<dcs:scene-file>test/scenes/minicooper/bd_column1d.jpg</dcs:scene-file>
			<dcs:scene-file>test/scenes/minicooper/bd_column1door_bump.jpg</dcs:scene-file>
			<dcs:scene-file>test/scenes/minicooper/bd_column1door.jpg</dcs:scene-file>
			<dcs:scene-file>test/scenes/minicooper/bd_column1door_o.inc</dcs:scene-file>
			<dcs:scene-file>test/scenes/minicooper/bd_column1.jpg</dcs:scene-file>
			<dcs:scene-file>test/scenes/minicooper/bd_column1_o.inc</dcs:scene-file>
			<dcs:scene-file>test/scenes/minicooper/bd_column2b_bump.jpg</dcs:scene-file>
			<dcs:scene-file>test/scenes/minicooper/bd_column2b.jpg</dcs:scene-file>
			<dcs:scene-file>test/scenes/minicooper/bd_column2_bump.jpg</dcs:scene-file>
			<dcs:scene-file>test/scenes/minicooper/bd_column2c_bump.jpg</dcs:scene-file>
			<dcs:scene-file>test/scenes/minicooper/bd_column2c.jpg</dcs:scene-file>
			<dcs:scene-file>test/scenes/minicooper/bd_column2.jpg</dcs:scene-file>
			<dcs:scene-file>test/scenes/minicooper/bd_column2_o.inc</dcs:scene-file>
			<dcs:scene-file>test/scenes/minicooper/bd_concrete2.jpg</dcs:scene-file>
			<dcs:scene-file>test/scenes/minicooper/bd_concrete_bump.jpg</dcs:scene-file>
			<dcs:scene-file>test/scenes/minicooper/bd_corner1a_bump.jpg</dcs:scene-file>
			<dcs:scene-file>test/scenes/minicooper/bd_corner1a.jpg</dcs:scene-file>
			<dcs:scene-file>test/scenes/minicooper/bd_corner1a_o.inc</dcs:scene-file>
			<dcs:scene-file>test/scenes/minicooper/bd_corner1b_bump.jpg</dcs:scene-file>
			<dcs:scene-file>test/scenes/minicooper/bd_corner1b.jpg</dcs:scene-file>
			<dcs:scene-file>test/scenes/minicooper/bd_corner1b_o.inc</dcs:scene-file>
			<dcs:scene-file>test/scenes/minicooper/bd_corner1_bump.jpg</dcs:scene-file>
			<dcs:scene-file>test/scenes/minicooper/bd_corner1.jpg</dcs:scene-file>
			<dcs:scene-file>test/scenes/minicooper/bd_corner1_o.inc</dcs:scene-file>
			<dcs:scene-file>test/scenes/minicooper/bd_corner2_bump.jpg</dcs:scene-file>
			<dcs:scene-file>test/scenes/minicooper/bd_corner2.jpg</dcs:scene-file>
			<dcs:scene-file>test/scenes/minicooper/bd_corner2_o.inc</dcs:scene-file>
			<dcs:scene-file>test/scenes/minicooper/bd_cover_bmp.jpg</dcs:scene-file>
			<dcs:scene-file>test/scenes/minicooper/bd_cover.jpg</dcs:scene-file>
			<dcs:scene-file>test/scenes/minicooper/bd_cover_o.inc</dcs:scene-file>
			<dcs:scene-file>test/scenes/minicooper/bd_curtain_o.inc</dcs:scene-file>
			<dcs:scene-file>test/scenes/minicooper/bd_dframe_o.inc</dcs:scene-file>
			<dcs:scene-file>test/scenes/minicooper/bd_door1.jpg</dcs:scene-file>
			<dcs:scene-file>test/scenes/minicooper/bd_door1_o.inc</dcs:scene-file>
			<dcs:scene-file>test/scenes/minicooper/bd_door2d_bump.jpg</dcs:scene-file>
			<dcs:scene-file>test/scenes/minicooper/bd_door2d.jpg</dcs:scene-file>
			<dcs:scene-file>test/scenes/minicooper/bd_door2.jpg</dcs:scene-file>
			<dcs:scene-file>test/scenes/minicooper/bd_door2_o.inc</dcs:scene-file>
			<dcs:scene-file>test/scenes/minicooper/bd_doortop_bump.jpg</dcs:scene-file>
			<dcs:scene-file>test/scenes/minicooper/bd_doortop.jpg</dcs:scene-file>
			<dcs:scene-file>test/scenes/minicooper/bd_doortop_o.inc</dcs:scene-file>
			<dcs:scene-file>test/scenes/minicooper/bd_front1a_bump.jpg</dcs:scene-file>
			<dcs:scene-file>test/scenes/minicooper/bd_front1a.jpg</dcs:scene-file>
			<dcs:scene-file>test/scenes/minicooper/bd_front1a_o.inc</dcs:scene-file>
			<dcs:scene-file>test/scenes/minicooper/bd_front1_bump.jpg</dcs:scene-file>
			<dcs:scene-file>test/scenes/minicooper/bd_front1.jpg</dcs:scene-file>
			<dcs:scene-file>test/scenes/minicooper/bd_front1_o.inc</dcs:scene-file>
			<dcs:scene-file>test/scenes/minicooper/bd_glass1_o.inc</dcs:scene-file>
			<dcs:scene-file>test/scenes/minicooper/bd_glass2_o.inc</dcs:scene-file>
			<dcs:scene-file>test/scenes/minicooper/bd_glass_o.inc</dcs:scene-file>
			<dcs:scene-file>test/scenes/minicooper/bd_ledge2_bump.jpg</dcs:scene-file>
			<dcs:scene-file>test/scenes/minicooper/bd_ledge2.jpg</dcs:scene-file>
			<dcs:scene-file>test/scenes/minicooper/bd_ledge2_o.inc</dcs:scene-file>
			<dcs:scene-file>test/scenes/minicooper/bd_ledge2w_bump.jpg</dcs:scene-file>
			<dcs:scene-file>test/scenes/minicooper/bd_ledge2w.jpg</dcs:scene-file>
			<dcs:scene-file>test/scenes/minicooper/bd_ledge2w_o.inc</dcs:scene-file>
			<dcs:scene-file>test/scenes/minicooper/bd_mdoorledge_bump.jpg</dcs:scene-file>
			<dcs:scene-file>test/scenes/minicooper/bd_mdoorledge.jpg</dcs:scene-file>
			<dcs:scene-file>test/scenes/minicooper/bd_mdoorledge_o.inc</dcs:scene-file>
			<dcs:scene-file>test/scenes/minicooper/bd_mdoor_o.inc</dcs:scene-file>
			<dcs:scene-file>test/scenes/minicooper/bd_mdoortop_o.inc</dcs:scene-file>
			<dcs:scene-file>test/scenes/minicooper/bd_number_o.inc</dcs:scene-file>
			<dcs:scene-file>test/scenes/minicooper/bd_road2.jpg</dcs:scene-file>
			<dcs:scene-file>test/scenes/minicooper/bd_road_hf3.jpg</dcs:scene-file>
			<dcs:scene-file>test/scenes/minicooper/bd_sidewalk_o.inc</dcs:scene-file>
			<dcs:scene-file>test/scenes/minicooper/bd_window1d_o.inc</dcs:scene-file>
			<dcs:scene-file>test/scenes/minicooper/bd_window1_o.inc</dcs:scene-file>
			<dcs:scene-file>test/scenes/minicooper/bd_window2_o.inc</dcs:scene-file>
			<dcs:scene-file>test/scenes/minicooper/bd_window.jpg</dcs:scene-file>
			<dcs:scene-file>test/scenes/minicooper/bd_windows_o.inc</dcs:scene-file>
			<dcs:scene-file>test/scenes/minicooper/car_paint2.jpg</dcs:scene-file>
			<dcs:scene-file>test/scenes/minicooper/headlight_bmp.jpg</dcs:scene-file>
			<dcs:scene-file>test/scenes/minicooper/headlight.jpg</dcs:scene-file>
			<dcs:scene-file>test/scenes/minicooper/lplate.jpg</dcs:scene-file>
			<dcs:scene-file>test/scenes/minicooper/mini_emblem.jpg</dcs:scene-file>
			<dcs:scene-file>test/scenes/minicooper/mini_mesh_o.inc</dcs:scene-file>
			<dcs:scene-file>test/scenes/minicooper/parkingsign.jpg</dcs:scene-file>
		</dcs:scene-files>
		<dcs:scene-width value="600"/>
		<dcs:scene-height value="600"/>
<!--
		<dcs:scene-bounding threshold="3"/>
		<dcs:scene-quality value="3"/>
		<dcs:scene-antialias threshold="3" method="1" jitter="0.0" depth="0"/>
		<dcs:scene-alpha/>
		<dcs:scene-lightbuf/>
		<dcs:scene-vistabuf/>
-->
		<dcs:scene-antialias threshold="3"/>
		<dcs:scene-blocksize value="64"/>
		<dcs:scene-imagefmt type="N" bits="8"/>
	</dcs:scene>
</dcs:gridpov-conf>
